full_name,stars,last_updated,tracked_since,description,url,last_release
liyupi/ai-guide,12948,2026-05-03T05:59:45Z,2026-04-28,程序员鱼皮的 AI 资源大全 + Vibe Coding 零基础教程，分享 OpenClaw 保姆级教程、大模型玩法（DeepSeek / GPT / Gemini / Claude）、最新 AI 资讯、Prompt 提示词大全、AI 知识百科（Agent Skills / RAG / MCP / A2A）、AI 编程教程（Harness Engineering）、AI 工具用法（Cursor /,https://github.com/liyupi/ai-guide,
steven2358/awesome-generative-ai,11933,2026-05-03T05:54:21Z,2026-04-28,A curated list of modern Generative Artificial Intelligence projects and services,https://github.com/steven2358/awesome-generative-ai,
saturndec/waoowaoo,11963,2026-05-03T05:58:07Z,2026-04-28,首家工业级全流程 AI 影视生产平台。Industry-first professional AI Agent platform for controllable film & video production. From shorts to live-action with Hollywood-standard workflows.,https://github.com/saturndec/waoowaoo,
Portkey-AI/gateway,11536,2026-05-01T05:52:55Z,2026-04-28,"A blazing fast AI Gateway with integrated guardrails. Route to 1,600+ LLMs, 50+ AI Guardrails with 1 fast & friendly API.",https://github.com/Portkey-AI/gateway,
ChatGPTNextWeb/NextChat,87876,2026-05-03T05:47:46Z,2026-04-28,✨ Light and Fast AI Assistant. Support: Web | iOS | MacOS | Android |  Linux | Windows,https://github.com/ChatGPTNextWeb/NextChat,
openai/openai-cookbook,73204,2026-05-03T06:04:04Z,2026-04-28,Examples and guides for using the OpenAI API,https://github.com/openai/openai-cookbook,
binary-husky/gpt_academic,70568,2026-05-03T05:26:38Z,2026-04-28,"为GPT/GLM等LLM大语言模型提供实用化交互接口，特别优化论文阅读/润色/写作体验，模块化设计，支持自定义快捷按钮&函数插件，支持Python和C++等项目剖析&自译解功能，PDF/LaTex论文翻译&总结功能，支持并行问询多种LLM模型，支持chatglm3等本地模型。接入通义千问, deepseekcoder, 讯飞星火, 文心一言, llama2, rwkv, claude2, moss",https://github.com/binary-husky/gpt_academic,
xtekky/gpt4free,66158,2026-05-03T05:43:04Z,2026-04-28,The official gpt4free repository | various collection of powerful language models | opus 4.6 gpt 5.3 kimi 2.5 deepseek v3.2 gemini 3,https://github.com/xtekky/gpt4free,
openinterpreter/open-interpreter,63370,2026-05-03T03:54:07Z,2026-04-28,A natural language interface for computers,https://github.com/openinterpreter/open-interpreter,
PlexPt/awesome-chatgpt-prompts-zh,59622,2026-05-03T06:12:31Z,2026-04-28,ChatGPT 中文调教指南。各种场景使用指南。学习怎么让它听你的话。,https://github.com/PlexPt/awesome-chatgpt-prompts-zh,
code-yeongyu/oh-my-openagent,55519,2026-05-03T06:21:32Z,2026-04-28,omo; the best agent harness - previously oh-my-opencode,https://github.com/code-yeongyu/oh-my-openagent,
lencx/ChatGPT,54355,2026-05-03T05:51:49Z,2026-04-28,"🔮 ChatGPT Desktop Application (Mac, Windows and Linux)",https://github.com/lencx/ChatGPT,
tw93/Pake,48345,2026-05-03T06:06:58Z,2026-04-28,🤱🏻 Turn any webpage into a desktop app with one command.,https://github.com/tw93/Pake,
Aider-AI/aider,44260,2026-05-03T06:11:50Z,2026-04-28,aider is AI pair programming in your terminal,https://github.com/Aider-AI/aider,
siyuan-note/siyuan,43501,2026-05-03T05:50:43Z,2026-04-28,"A privacy-first, self-hosted, fully open source personal knowledge management software, written in typescript and golang.",https://github.com/siyuan-note/siyuan,
janhq/jan,42336,2026-05-03T05:39:47Z,2026-04-28,Jan is an open source alternative to ChatGPT that runs 100% offline on your computer.,https://github.com/janhq/jan,
LC044/WeChatMsg,41321,2026-05-03T05:14:57Z,2026-04-28,,https://github.com/LC044/WeChatMsg,
HKUDS/nanobot,41538,2026-05-03T06:20:53Z,2026-04-28,"""🐈 nanobot: The Ultra-Lightweight Personal AI Agent""",https://github.com/HKUDS/nanobot,
chatboxai/chatbox,39768,2026-05-03T06:16:32Z,2026-04-28,Powerful AI Client,https://github.com/chatboxai/chatbox,
2noise/ChatTTS,39189,2026-05-02T16:56:35Z,2026-04-28,A generative speech model for daily dialogue.,https://github.com/2noise/ChatTTS,
QuivrHQ/quivr,39123,2026-05-03T04:47:04Z,2026-04-28,"Opiniated RAG for integrating GenAI in your apps 🧠   Focus on your product rather than the RAG. Easy integration in existing products with customisation!  Any LLM: GPT4, Groq, Llama. Any Vectorstore: ",https://github.com/QuivrHQ/quivr,
mudler/LocalAI,46015,2026-05-03T06:20:58Z,2026-04-28,"LocalAI is the open-source AI engine. Run any model - LLMs, vision, voice, image, video - on any hardware. No GPU required.",https://github.com/mudler/LocalAI,
huggingface/diffusers,33523,2026-05-03T01:22:55Z,2026-04-28,"🤗 Diffusers: State-of-the-art diffusion models for image, video, and audio generation in PyTorch.",https://github.com/huggingface/diffusers,
Sanster/IOPaint,23042,2026-05-03T02:19:32Z,2026-04-28,"Image inpainting tool powered by SOTA AI Model. Remove any unwanted object, defect, people from your pictures or erase and replace(powered by stable diffusion) any thing on your pictures.",https://github.com/Sanster/IOPaint,
camenduru/stable-diffusion-webui-colab,15944,2026-05-02T15:50:33Z,2026-04-28,stable diffusion webui colab,https://github.com/camenduru/stable-diffusion-webui-colab,
divamgupta/diffusionbee-stable-diffusion-ui,13559,2026-05-03T00:52:33Z,2026-04-28,Diffusion Bee is the easiest way to run Stable Diffusion locally on your M1 Mac. Comes with a one-click installer. No dependencies or technical knowledge needed.,https://github.com/divamgupta/diffusionbee-stable-diffusion-ui,
hua1995116/awesome-ai-painting,11772,2026-05-01T23:40:31Z,2026-04-28,AI绘画资料合集（包含国内外可使用平台、使用教程、参数教程、部署教程、业界新闻等等） Stable diffusion、AnimateDiff、Stable Cascade 、Stable SDXL Turbo,https://github.com/hua1995116/awesome-ai-painting,
Baiyuetribe/paper2gui,10725,2026-05-02T09:37:19Z,2026-04-28,Convert AI papers to GUI，Make it easy and convenient for everyone to use artificial intelligence technology。让每个人都简单方便的使用前沿人工智能技术,https://github.com/Baiyuetribe/paper2gui,
openvinotoolkit/openvino,10168,2026-05-02T17:57:50Z,2026-04-28,OpenVINO™ is an open source toolkit for optimizing and deploying AI inference,https://github.com/openvinotoolkit/openvino,
Acly/krita-ai-diffusion,10038,2026-05-03T01:25:05Z,2026-04-28,"Streamlined interface for generating images with AI in Krita. Inpaint and outpaint with optional text prompt, no tweaking required.",https://github.com/Acly/krita-ai-diffusion,
Stability-AI/StableStudio,9041,2026-05-02T03:14:10Z,2026-04-28,Community interface for generative AI,https://github.com/Stability-AI/StableStudio,
ashawkey/stable-dreamfusion,8831,2026-05-02T14:37:41Z,2026-04-28,Text-to-3D & Image-to-3D & Mesh Exportation with NeRF + Diffusion.,https://github.com/ashawkey/stable-dreamfusion,
carson-katri/dream-textures,8157,2026-05-02T20:38:03Z,2026-04-28,Stable Diffusion built-in to Blender,https://github.com/carson-katri/dream-textures,
LykosAI/StabilityMatrix,8098,2026-05-03T02:52:02Z,2026-04-28,Multi-Platform Package Manager for Stable Diffusion,https://github.com/LykosAI/StabilityMatrix,
NexaAI/nexa-sdk,7979,2026-04-29T18:11:24Z,2026-04-28,"Run frontier LLMs and VLMs with day-0 model support across GPU, NPU, and CPU, with comprehensive runtime coverage for PC (Python/C++), mobile (Android & iOS), and Linux/IoT (Arm64 & x86 Docker). Suppo",https://github.com/NexaAI/nexa-sdk,
TheLastBen/fast-stable-diffusion,7911,2026-05-03T01:49:56Z,2026-04-28,fast-stable-diffusion + DreamBooth,https://github.com/TheLastBen/fast-stable-diffusion,
MochiDiffusion/MochiDiffusion,7892,2026-05-02T20:33:03Z,2026-04-28,Run Stable Diffusion on Mac natively,https://github.com/MochiDiffusion/MochiDiffusion,
XavierXiao/Dreambooth-Stable-Diffusion,7741,2026-04-30T06:30:17Z,2026-04-28,Implementation of Dreambooth (https://arxiv.org/abs/2208.12242) with Stable Diffusion,https://github.com/XavierXiao/Dreambooth-Stable-Diffusion,
cloneofsimo/lora,7536,2026-05-02T18:57:30Z,2026-04-28,Using Low-rank adaptation to quickly fine-tune diffusion models.,https://github.com/cloneofsimo/lora,
ZHO-ZHO-ZHO/ComfyUI-Workflows-ZHO,7441,2026-05-03T04:32:30Z,2026-04-28,我的 ComfyUI 工作流合集 | My ComfyUI workflows collection,https://github.com/ZHO-ZHO-ZHO/ComfyUI-Workflows-ZHO,
AbdBarho/stable-diffusion-webui-docker,7321,2026-05-02T08:11:58Z,2026-04-28,Easy Docker setup for Stable Diffusion with user-friendly UI,https://github.com/AbdBarho/stable-diffusion-webui-docker,
AbdullahAlfaraj/Auto-Photoshop-StableDiffusion-Plugin,7251,2026-05-03T04:27:45Z,2026-04-28,A user-friendly plug-in that makes it easy to generate stable diffusion images inside Photoshop using either Automatic or ComfyUI as a backend.,https://github.com/AbdullahAlfaraj/Auto-Photoshop-StableDiffusion-Plugin,
civitai/civitai,7100,2026-05-02T21:03:10Z,2026-04-28,"A repository of models, textual inversions, and more",https://github.com/civitai/civitai,
vladmandic/sdnext,7077,2026-05-02T12:09:24Z,2026-04-28,"SD.Next: All-in-one WebUI for AI generative image and video creation, captioning and processing",https://github.com/vladmandic/sdnext,
mylxsw/aidea,6947,2026-05-02T10:01:39Z,2026-04-28,"An APP that integrates mainstream large language models and image generation models, built with Flutter, with fully open-source code.",https://github.com/mylxsw/aidea,
ChatAnyTeam/ChatAny,6517,2026-05-03T02:17:54Z,2026-04-28,🌻 一键拥有你自己的 ChatGPT+众多AI 网页服务 | One click access to your own ChatGPT+Many AI web services,https://github.com/ChatAnyTeam/ChatAny,
SkalskiP/courses,6438,2026-05-02T17:57:03Z,2026-04-28,This repository is a curated collection of links to various courses and resources about Artificial Intelligence (AI),https://github.com/SkalskiP/courses,
swyxio/ai-notes,6211,2026-05-02T09:42:18Z,2026-04-28,"notes for software engineers getting up to speed on new AI developments. Serves as datastore for https://latent.space writing, and product brainstorming, but has cleaned up canonical references under ",https://github.com/swyxio/ai-notes,
microsoft/markitdown,119637,2026-05-03T06:09:49Z,2026-04-28,Python tool for converting files and office documents to Markdown.,https://github.com/microsoft/markitdown,
AntonOsika/gpt-engineer,55228,2026-05-03T04:58:51Z,2026-04-28,CLI platform to experiment with codegen. Precursor to: https://lovable.dev,https://github.com/AntonOsika/gpt-engineer,
dbeaver/dbeaver,49837,2026-05-03T03:53:50Z,2026-04-28,Free universal database tool and SQL client,https://github.com/dbeaver/dbeaver,
ggml-org/whisper.cpp,49299,2026-05-03T05:47:37Z,2026-04-28,Port of OpenAI's Whisper model in C/C++,https://github.com/ggml-org/whisper.cpp,
BerriAI/litellm,45517,2026-05-03T06:08:24Z,2026-04-28,"Python SDK, Proxy Server (AI Gateway) to call 100+ LLM APIs in OpenAI (or native) format, with cost tracking, guardrails, loadbalancing and logging. [Bedrock, Azure, OpenAI, VertexAI, Cohere, Anthropi",https://github.com/BerriAI/litellm,
zhayujie/CowAgent,43976,2026-05-03T04:14:51Z,2026-04-28,CowAgent (chatgpt-on-wechat) 是基于大模型的超级AI助理，能主动思考和任务规划、访问操作系统和外部资源、创造和执行Skills、通过长期记忆和知识库不断成长，比OpenClaw更轻量和便捷。同时支持微信、飞书、钉钉、企微、QQ、公众号、网页等接入，可选择DeepSeek/OpenAI/Claude/Gemini/ MiniMax/Qwen/GLM/LinkAI，能处理文,https://github.com/zhayujie/CowAgent,
danny-avila/LibreChat,36475,2026-05-03T05:41:11Z,2026-04-28,"Enhanced ChatGPT Clone: Features Agents, MCP, DeepSeek, Anthropic, AWS, OpenAI, Responses API, Azure, Groq, o1, GPT-5, Mistral, OpenRouter, Vertex AI, Gemini, Artifacts, AI model switching, message se",https://github.com/danny-avila/LibreChat,
reworkd/AgentGPT,36048,2026-05-03T03:54:05Z,2026-04-28,"🤖 Assemble, configure, and deploy autonomous AI Agents in your browser.",https://github.com/reworkd/AgentGPT,
lutzroeder/netron,32833,2026-05-02T22:13:43Z,2026-04-28,"Visualizer for neural network, deep learning and machine learning models",https://github.com/lutzroeder/netron,
qdrant/qdrant,30975,2026-05-03T05:14:09Z,2026-04-28,"Qdrant - High-performance, massive-scale Vector Database and Vector Search Engine for the next generation of AI. Also available in the cloud https://cloud.qdrant.io/",https://github.com/qdrant/qdrant,
ChristosChristofidis/awesome-deep-learning,28010,2026-05-03T02:50:44Z,2026-04-28,"A curated list of awesome Deep Learning tutorials, projects and communities.",https://github.com/ChristosChristofidis/awesome-deep-learning,
ageron/handson-ml,25657,2026-05-02T09:16:42Z,2026-04-28,⛔️ DEPRECATED – See https://github.com/ageron/handson-ml3 or handson-mlp instead.,https://github.com/ageron/handson-ml,
PaddlePaddle/Paddle,23869,2026-05-02T14:08:59Z,2026-04-28,PArallel Distributed Deep LEarning: Machine Learning Framework from Industrial Practice （『飞桨』核心框架，深度学习&机器学习高性能单机、分布式训练和跨平台部署）,https://github.com/PaddlePaddle/Paddle,
Tencent/ncnn,23178,2026-05-03T03:12:07Z,2026-04-28,ncnn is a high-performance neural network inference framework optimized for the mobile platform,https://github.com/Tencent/ncnn,
zergtant/pytorch-handbook,21628,2026-05-02T11:22:14Z,2026-04-28,pytorch handbook是一本开源的书籍，目标是帮助那些希望和使用PyTorch进行深度学习开发和研究的朋友快速入门，其中包含的Pytorch教程全部通过测试保证可以成功运行,https://github.com/zergtant/pytorch-handbook,
onnx/onnx,20757,2026-05-03T02:57:57Z,2026-04-28,Open standard for machine learning interoperability,https://github.com/onnx/onnx,
tensorflow/tfjs,19118,2026-05-02T19:02:34Z,2026-04-28,A WebGL accelerated JavaScript library for training and deploying ML models.,https://github.com/tensorflow/tfjs,
ujjwalkarn/Machine-Learning-Tutorials,17778,2026-05-03T03:38:44Z,2026-04-28,"machine learning and deep learning tutorials, articles and other resources ",https://github.com/ujjwalkarn/Machine-Learning-Tutorials,
microsoft/CNTK,17607,2026-05-02T13:42:27Z,2026-04-28,"Microsoft Cognitive Toolkit (CNTK), an open source deep-learning toolkit",https://github.com/microsoft/CNTK,
NVlabs/instant-ngp,17375,2026-05-02T21:35:56Z,2026-04-28,Instant neural graphics primitives: lightning fast NeRF and more,https://github.com/NVlabs/instant-ngp,
bharathgs/Awesome-pytorch-list,16490,2026-05-03T01:53:42Z,2026-04-28,"A comprehensive list of pytorch related content on github,such as different models,implementations,helper libraries,tutorials etc.",https://github.com/bharathgs/Awesome-pytorch-list,
piskvorky/gensim,16403,2026-05-03T06:00:49Z,2026-04-28,Topic Modelling for Humans,https://github.com/piskvorky/gensim,
tracel-ai/burn,14985,2026-05-03T02:28:27Z,2026-04-28,"Burn is a next generation tensor library and Deep Learning Framework that doesn't compromise on flexibility, efficiency and portability.",https://github.com/tracel-ai/burn,
BrainJS/brain.js,14860,2026-05-01T20:18:41Z,2026-04-28,🤖 GPU accelerated Neural networks in JavaScript for Browsers and Node.js,https://github.com/BrainJS/brain.js,
microsoft/nni,14351,2026-05-02T07:53:24Z,2026-04-28,"An open source AutoML toolkit for automate machine learning lifecycle, including feature engineering, neural architecture search, model compression and hyper-parameter tuning.",https://github.com/microsoft/nni,
janishar/mit-deep-learning-book-pdf,14021,2026-05-02T17:57:51Z,2026-04-28,"MIT Deep Learning Book in PDF format (complete and parts) by Ian Goodfellow, Yoshua Bengio and Aaron Courville",https://github.com/janishar/mit-deep-learning-book-pdf,
owainlewis/awesome-artificial-intelligence,13607,2026-05-03T05:50:28Z,2026-04-28,"A curated list of Artificial Intelligence (AI) courses, books, video lectures and papers.",https://github.com/owainlewis/awesome-artificial-intelligence,
MorvanZhou/tutorials,12909,2026-05-01T15:30:26Z,2026-04-28,机器学习相关教程,https://github.com/MorvanZhou/tutorials,
rasbt/python-machine-learning-book,12614,2026-05-02T09:15:32Z,2026-04-28,"The ""Python Machine Learning (1st edition)""  book code repository and info resource",https://github.com/rasbt/python-machine-learning-book,
willwulfken/MidJourney-Styles-and-Keywords-Reference,12285,2026-05-01T18:17:05Z,2026-04-28,"A reference containing Styles and Keywords that you can use with MidJourney AI. There are also pages showing resolution comparison, image weights, and much more!",https://github.com/willwulfken/MidJourney-Styles-and-Keywords-Reference,
ludwig-ai/ludwig,11682,2026-05-02T09:20:14Z,2026-04-28,"Low-code framework for building custom LLMs, neural networks, and other AI models",https://github.com/ludwig-ai/ludwig,
kornia/kornia,11191,2026-05-02T18:11:36Z,2026-04-28,🐍 Geometric Computer Vision Library for Spatial AI,https://github.com/kornia/kornia,
zyddnys/manga-image-translator,9826,2026-05-02T20:16:25Z,2026-04-28,Translate manga/image 一键翻译各类图片内文字 https://cotrans.touhou.ai/ (no longer working),https://github.com/zyddnys/manga-image-translator,
tflearn/tflearn,9589,2026-04-24T17:20:50Z,2026-04-28,Deep learning library featuring a higher-level API for TensorFlow.,https://github.com/tflearn/tflearn,
Shubhamsaboo/awesome-llm-apps,108466,2026-05-03T06:21:36Z,2026-04-28,"100+ AI Agent & RAG apps you can actually run — clone, customize, ship.",https://github.com/Shubhamsaboo/awesome-llm-apps,
PaddlePaddle/PaddleOCR,76977,2026-05-03T06:14:30Z,2026-04-28,"Turn any PDF or image document into structured data for your AI. A powerful, lightweight OCR toolkit that bridges the gap between images/PDFs and LLMs. Supports 100+ languages.",https://github.com/PaddlePaddle/PaddleOCR,
milvus-io/milvus,44097,2026-05-03T04:45:20Z,2026-04-28,"Milvus is a high-performance, cloud-native vector database built for scalable vector ANN search",https://github.com/milvus-io/milvus,
datawhalechina/hello-agents,42256,2026-05-03T06:14:20Z,2026-04-28,📚 《从零开始构建智能体》——从零开始的智能体原理与实践教程,https://github.com/datawhalechina/hello-agents,
mindsdb/mindsdb,39094,2026-05-03T02:49:30Z,2026-04-28,AI Data Vault - A query engine for AI Agents to securely query data from any datasource,https://github.com/mindsdb/mindsdb,
chatchat-space/Langchain-Chatchat,37951,2026-05-03T04:53:36Z,2026-04-28,"Langchain-Chatchat（原Langchain-ChatGLM）基于 Langchain 与 ChatGLM, Qwen 与 Llama 等语言模型的 RAG 与 Agent 应用 | Langchain-Chatchat (formerly langchain-ChatGLM), local knowledge based LLM (like ChatGLM, Qwen and Ll",https://github.com/chatchat-space/Langchain-Chatchat,
HKUDS/LightRAG,34682,2026-05-03T06:21:47Z,2026-04-28,"[EMNLP2025] ""LightRAG: Simple and Fast Retrieval-Augmented Generation""",https://github.com/HKUDS/LightRAG,
khoj-ai/khoj,34360,2026-05-03T05:30:16Z,2026-04-28,"Your AI second brain. Self-hostable. Get answers from the web or your docs. Build custom agents, schedule automations, do deep research. Turn any online or local LLM into your personal, autonomous AI ",https://github.com/khoj-ai/khoj,
patchy631/ai-engineering-hub,34546,2026-05-03T06:18:23Z,2026-04-28,"In-depth tutorials on LLMs, RAGs and real-world AI agent applications.",https://github.com/patchy631/ai-engineering-hub,
microsoft/graphrag,32730,2026-05-03T05:12:57Z,2026-04-28,A modular graph-based Retrieval-Augmented Generation (RAG) system,https://github.com/microsoft/graphrag,
ZhuLinsen/daily_stock_analysis,33738,2026-05-03T06:15:22Z,2026-04-28,LLM驱动的 A/H/美股智能分析器：多数据源行情 + 实时新闻 + LLM决策仪表盘 + 多渠道推送，零成本定时运行，纯白嫖. LLM-powered stock analysis system for A/H/US markets.,https://github.com/ZhuLinsen/daily_stock_analysis,
datawhalechina/happy-llm,29805,2026-05-03T05:48:23Z,2026-04-28,📚 从零开始构建大模型,https://github.com/datawhalechina/happy-llm,
onyx-dot-app/onyx,28873,2026-05-03T06:07:52Z,2026-04-28,Open Source AI Platform - AI Chat with advanced features that works with every LLM,https://github.com/onyx-dot-app/onyx,
labring/FastGPT,27890,2026-05-03T05:56:50Z,2026-04-28,"FastGPT is a knowledge-based platform built on the LLMs, offers a comprehensive suite of out-of-the-box capabilities such as data processing, RAG retrieval, and visual AI workflow orchestration, letti",https://github.com/labring/FastGPT,
NirDiamant/RAG_Techniques,27080,2026-05-01T06:08:07Z,2026-04-28,This repository showcases various advanced techniques for Retrieval-Augmented Generation (RAG) systems. Each technique has a detailed notebook tutorial.,https://github.com/NirDiamant/RAG_Techniques,
Snailclimb/JavaGuide,155373,2026-05-03T05:49:11Z,2026-04-28,Java 面试 & 后端通用面试指南，覆盖计算机基础、数据库、分布式、高并发、系统设计与 AI 应用开发,https://github.com/Snailclimb/JavaGuide,
huginn/huginn,49217,2026-05-03T03:36:18Z,2026-04-28,Create agents that monitor and act on your behalf.  Your agents are standing by!,https://github.com/huginn/huginn,
pingcap/tidb,40048,2026-05-02T20:50:09Z,2026-04-28,"TiDB is built for agentic workloads that grow unpredictably, with ACID guarantees and native support for transactions, analytics, and vector search. No data silos. No noisy neighbors. No infrastructur",https://github.com/pingcap/tidb,
alibaba/arthas,37288,2026-05-03T03:53:58Z,2026-04-28,Alibaba Java Diagnostic Tool Arthas/Alibaba Java诊断利器Arthas,https://github.com/alibaba/arthas,
1Panel-dev/1Panel,35255,2026-05-03T05:44:02Z,2026-04-28,"🔥 1Panel is a modern, open-source VPS control panel — and the only one with native AI agent support. Run Ollama models, deploy OpenClaw agents, and manage your entire server stack from one clean web i",https://github.com/1Panel-dev/1Panel,
alibaba/nacos,32905,2026-05-03T03:53:57Z,2026-04-28,"an easy-to-use dynamic service discovery, configuration and service management platform for building AI cloud native applications.",https://github.com/alibaba/nacos,
continuedev/continue,32931,2026-05-03T06:02:37Z,2026-04-28,"⏩ Source-controlled AI checks, enforceable in CI. Powered by the open-source Continue CLI",https://github.com/continuedev/continue,
AstrBotDevs/AstrBot,31206,2026-05-03T06:17:31Z,2026-04-28,"AI Agent Assistant that integrates lots of IM platforms, LLMs, plugins and AI feature, and can be your openclaw alternative. ✨",https://github.com/AstrBotDevs/AstrBot,
zeroclaw-labs/zeroclaw,30935,2026-05-03T05:27:10Z,2026-04-28,"Fast, small, and fully autonomous AI personal assistant infrastructure, ANY OS, ANY PLATFORM — deploy anywhere, swap anything 🦀",https://github.com/zeroclaw-labs/zeroclaw,
CopilotKit/CopilotKit,30586,2026-05-03T02:40:23Z,2026-04-28,The Frontend Stack for Agents & Generative UI. React + Angular.  Makers of the AG-UI Protocol,https://github.com/CopilotKit/CopilotKit,
bytedance/UI-TARS-desktop,29594,2026-05-03T04:51:23Z,2026-04-28,The Open-Source Multimodal AI Agent Stack: Connecting Cutting-Edge AI Models and Agent Infra,https://github.com/bytedance/UI-TARS-desktop,
qualcomm/nexa-sdk,7988,2026-05-03T04:46:42Z,2026-05-01,"Run frontier LLMs and VLMs with day-0 model support across GPU, NPU, and CPU, with comprehensive runtime coverage for PC (Python/C++), mobile (Android & iOS), and Linux/IoT (Arm64 & x86 Docker). Suppo",https://github.com/qualcomm/nexa-sdk,
nexu-io/open-design,16796,2026-05-03T06:21:48Z,2026-05-02,"🎨 Local-first, open-source alternative to Anthropic's Claude Design. ⚡ 19 Skills · ✨ 71 brand-grade Design Systems 🖼 Generate web · desktop · mobile prototypes · slides · images · videos · HyperFrames",https://github.com/nexu-io/open-design,
safishamsi/graphify,40959,2026-05-03T06:17:01Z,2026-05-02,"AI coding assistant skill (Claude Code, Codex, OpenCode, Cursor, Gemini CLI, and more). Turn any folder of code, SQL schemas, R scripts, shell scripts, docs, papers, images, or videos into a queryable",https://github.com/safishamsi/graphify,
