full_name,stars,last_updated,tracked_since,description,url,last_release
Significant-Gravitas/AutoGPT,183949,2026-05-03T05:45:53Z,2026-04-28,"AutoGPT is the vision of accessible AI for everyone, to use and to build on. Our mission is to provide the tools, so that you can focus on what matters.",https://github.com/Significant-Gravitas/AutoGPT,
ollama/ollama,170586,2026-05-03T06:04:05Z,2026-04-28,"Get up and running with Kimi-K2.5, GLM-5, MiniMax, DeepSeek, gpt-oss, Qwen, Gemma and other models.",https://github.com/ollama/ollama,
affaan-m/everything-claude-code,172221,2026-05-03T06:20:38Z,2026-04-28,"The agent harness performance optimization system. Skills, instincts, memory, security, and research-first development for Claude Code, Codex, Opencode, Cursor and beyond.",https://github.com/affaan-m/everything-claude-code,
f/prompts.chat,161409,2026-05-03T06:14:02Z,2026-04-28,"f.k.a. Awesome ChatGPT Prompts. Share, discover, and collect prompts from the community. Free and open source — self-host for your organization with complete privacy.",https://github.com/f/prompts.chat,
huggingface/transformers,160192,2026-05-03T06:09:45Z,2026-04-28,"🤗 Transformers: the model-definition framework for state-of-the-art machine learning models in text, vision, audio, and multimodal models, for both inference and training. ",https://github.com/huggingface/transformers,
langgenius/dify,139912,2026-05-03T06:11:48Z,2026-04-28,Production-ready platform for agentic workflow development.,https://github.com/langgenius/dify,
langchain-ai/langchain,135654,2026-05-03T05:48:39Z,2026-04-28,The agent engineering platform,https://github.com/langchain-ai/langchain,
open-webui/open-webui,135261,2026-05-03T06:16:36Z,2026-04-28,"User-friendly AI Interface (Supports Ollama, OpenAI API, ...)",https://github.com/open-webui/open-webui,
NousResearch/hermes-agent,130092,2026-05-03T06:21:54Z,2026-04-28,The agent that grows with you,https://github.com/NousResearch/hermes-agent,
firecrawl/firecrawl,114366,2026-05-03T06:20:17Z,2026-04-28,"🔥 The API to search, scrape, and interact with the web for AI",https://github.com/firecrawl/firecrawl,
rasbt/LLMs-from-scratch,91842,2026-05-03T05:58:07Z,2026-04-28,"Implement a ChatGPT-like LLM in PyTorch from scratch, step by step",https://github.com/rasbt/LLMs-from-scratch,
browser-use/browser-use,91759,2026-05-03T06:20:33Z,2026-04-28,🌐 Make websites accessible for AI agents. Automate tasks online with ease.,https://github.com/browser-use/browser-use,
mlabonne/llm-course,78942,2026-05-03T05:21:37Z,2026-04-28,Course to get into Large Language Models (LLMs) with roadmaps and Colab notebooks.,https://github.com/mlabonne/llm-course,
vllm-project/vllm,78895,2026-05-03T05:18:07Z,2026-04-28,A high-throughput and memory-efficient inference and serving engine for LLMs,https://github.com/vllm-project/vllm,
OpenHands/OpenHands,72533,2026-05-03T06:10:58Z,2026-04-28,🙌 OpenHands: AI-Driven Development,https://github.com/OpenHands/OpenHands,
hiyouga/LlamaFactory,70849,2026-05-03T04:52:32Z,2026-04-28,Unified Efficient Fine-Tuning of 100+ LLMs & VLMs (ACL 2024),https://github.com/hiyouga/LlamaFactory,
FoundationAgents/MetaGPT,67643,2026-05-03T04:30:16Z,2026-04-28,"🌟 The Multi-Agent Framework: First AI Software Company, Towards Natural Language Programming",https://github.com/FoundationAgents/MetaGPT,
bytedance/deer-flow,64540,2026-05-03T05:20:35Z,2026-04-28,"An open-source long-horizon SuperAgent harness that researches, codes, and creates. With the help of sandboxes, memories, tools, skill, subagents and message gateway, it handles different levels of ta",https://github.com/bytedance/deer-flow,
unslothai/unsloth,63474,2026-05-03T05:55:18Z,2026-04-28,"Web UI for training and running open models like Gemma 4, Qwen3.6, DeepSeek, gpt-oss locally.",https://github.com/unslothai/unsloth,
pathwaycom/llm-app,59862,2026-05-03T04:50:21Z,2026-04-28,"Ready-to-run cloud templates for RAG, AI pipelines, and enterprise search with live data. 🐳Docker-friendly.⚡Always in sync with Sharepoint, Google Drive, S3, Kafka, PostgreSQL, real-time data APIs, an",https://github.com/pathwaycom/llm-app,
Mintplex-Labs/anything-llm,59431,2026-05-03T05:34:23Z,2026-04-28,The all-in-one AI productivity accelerator. On device and privacy first with no annoying setup or configuration.,https://github.com/Mintplex-Labs/anything-llm,
shareAI-lab/learn-claude-code,57853,2026-05-03T06:19:40Z,2026-04-28,"Bash is all you need -  A nano claude code–like 「agent harness」, built from 0 to 1",https://github.com/shareAI-lab/learn-claude-code,
sansan0/TrendRadar,56082,2026-05-03T06:18:31Z,2026-04-28,"⭐AI-driven public opinion & trend monitor with multi-platform aggregation, RSS, and smart alerts.🎯 告别信息过载，你的 AI 舆情监控助手与热点筛选工具！聚合多平台热点 +  RSS 订阅，支持关键词精准筛选。AI 智能筛选新闻 + AI 翻译 +  AI 分析简报直推手机，也支持接入 MCP 架构，",https://github.com/sansan0/TrendRadar,
mem0ai/mem0,54627,2026-05-03T06:04:46Z,2026-04-28,Universal memory layer for AI Agents,https://github.com/mem0ai/mem0,
TauricResearch/TradingAgents,63394,2026-05-03T06:22:00Z,2026-04-28,TradingAgents: Multi-Agents LLM Financial Trading Framework,https://github.com/TauricResearch/TradingAgents,
upstash/context7,54321,2026-05-03T05:59:11Z,2026-04-28,Context7 Platform -- Up-to-date code documentation for LLMs and AI code editors,https://github.com/upstash/context7,
MemPalace/mempalace,50799,2026-05-03T06:20:16Z,2026-04-28,The best-benchmarked open-source AI memory system. And it's free.,https://github.com/MemPalace/mempalace,
run-llama/llama_index,49102,2026-05-03T05:41:20Z,2026-04-28,LlamaIndex is the leading document agent and OCR platform,https://github.com/run-llama/llama_index,
JuliusBrussee/caveman,52608,2026-05-03T06:21:11Z,2026-04-28,🪨 why use many token when few token do trick — Claude Code skill that cuts 65% of tokens by talking like caveman,https://github.com/JuliusBrussee/caveman,
jeecgboot/JeecgBoot,46069,2026-05-03T03:53:58Z,2026-04-28,AI低代码平台，支持「低代码 + 零代码」双模式：零代码 5 分钟搭建业务系统，低代码模式一键生成前后端代码。 内置AI 应用，支持AI聊天、知识库、流程编排、MCP与插件，支持各种模型。Skills能力实现：一句话画流程图、设计表单、生成系统。 引领 AI生成→在线配置→代码生成→手工合并的开发模式，解决Java项目80%的重复工作，快速提高效率，又不失灵活性。,https://github.com/jeecgboot/JeecgBoot,
openclaw/openclaw,367640,2026-05-03T06:19:10Z,2026-04-28,Your own personal AI assistant. Any OS. Any Platform. The lobster way. 🦞 ,https://github.com/openclaw/openclaw,
n8n-io/n8n,186508,2026-05-03T05:57:49Z,2026-04-28,"Fair-code workflow automation platform with native AI capabilities. Combine visual building with custom code, self-host or cloud, 400+ integrations.",https://github.com/n8n-io/n8n,
AUTOMATIC1111/stable-diffusion-webui,162697,2026-05-03T06:05:40Z,2026-04-28,Stable Diffusion web UI,https://github.com/AUTOMATIC1111/stable-diffusion-webui,
x1xhlol/system-prompts-and-models-of-ai-tools,136573,2026-05-03T05:44:40Z,2026-04-28,"FULL Augment Code, Claude Code, Cluely, CodeBuddy, Comet, Cursor, Devin AI, Junie, Kiro, Leap.new, Lovable, Manus, NotionAI, Orchids.app, Perplexity, Poke, Qoder, Replit, Same.dev, Trae, Traycer AI, V",https://github.com/x1xhlol/system-prompts-and-models-of-ai-tools,
Comfy-Org/ComfyUI,111112,2026-05-03T06:13:33Z,2026-04-28,"The most powerful and modular diffusion model GUI, api and backend with a graph/nodes interface.",https://github.com/Comfy-Org/ComfyUI,
microsoft/generative-ai-for-beginners,110112,2026-05-03T04:51:53Z,2026-04-28,"21 Lessons, Get Started Building with Generative AI ",https://github.com/microsoft/generative-ai-for-beginners,
google-gemini/gemini-cli,102996,2026-05-03T06:19:22Z,2026-04-28,An open-source AI agent that brings the power of Gemini directly into your terminal.,https://github.com/google-gemini/gemini-cli,
supabase/supabase,101774,2026-05-03T06:15:28Z,2026-04-28,"The Postgres development platform. Supabase gives you a dedicated Postgres database to build your web, mobile, and AI applications.",https://github.com/supabase/supabase,
hacksider/Deep-Live-Cam,92569,2026-05-03T06:12:40Z,2026-04-28,real time face swap and one-click video deepfake with only a single image,https://github.com/hacksider/Deep-Live-Cam,
github/spec-kit,92217,2026-05-03T06:03:26Z,2026-04-28,💫 Toolkit to help you get started with Spec-Driven Development,https://github.com/github/spec-kit,
punkpeye/awesome-mcp-servers,86133,2026-05-03T05:44:41Z,2026-04-28,A collection of MCP servers.,https://github.com/punkpeye/awesome-mcp-servers,
netdata/netdata,78679,2026-05-03T05:57:02Z,2026-04-28,"The fastest path to AI-powered full stack observability, even for lean teams.",https://github.com/netdata/netdata,
lobehub/lobehub,75968,2026-05-03T06:20:52Z,2026-04-28,"The ultimate space for work and life — to find, build, and collaborate with agent teammates that grow with you. We are taking agent harness to the next level — enabling multi-agent collaboration, effo",https://github.com/lobehub/lobehub,
daytonaio/daytona,72384,2026-05-03T05:52:03Z,2026-04-28,Daytona is a Secure and Elastic Infrastructure for Running AI-Generated Code,https://github.com/daytonaio/daytona,
thedotmack/claude-mem,71171,2026-05-03T06:20:59Z,2026-04-28,"A Claude Code plugin that automatically captures everything Claude does during your coding sessions, compresses it with AI (using Claude's agent-sdk), and injects relevant context back into future ses",https://github.com/thedotmack/claude-mem,
OpenBB-finance/OpenBB,66896,2026-05-03T05:40:27Z,2026-04-28,"Financial data platform for analysts, quants and AI agents.",https://github.com/OpenBB-finance/OpenBB,
docling-project/docling,59024,2026-05-03T06:16:01Z,2026-04-28,Get your documents ready for gen AI,https://github.com/docling-project/docling,
microsoft/autogen,57663,2026-05-03T05:42:02Z,2026-04-28,A programming framework for agentic AI,https://github.com/microsoft/autogen,
meilisearch/meilisearch,57392,2026-05-03T05:07:50Z,2026-04-28,A lightning-fast search engine API bringing AI-powered hybrid search to your sites and applications.,https://github.com/meilisearch/meilisearch,
harry0703/MoneyPrinterTurbo,56655,2026-05-03T05:59:48Z,2026-04-28,利用AI大模型，一键生成高清短视频 Generate short videos with one click using AI LLM.,https://github.com/harry0703/MoneyPrinterTurbo,
FlowiseAI/Flowise,52500,2026-05-03T04:24:27Z,2026-04-28,"Build AI Agents, Visually",https://github.com/FlowiseAI/Flowise,
jingyaogong/minimind,48747,2026-05-03T05:32:53Z,2026-04-28,🚀 「大模型」2小时完全从0训练64M的小参数LLM！🌏 Train a 64M-parameter LLM from scratch in just 2h!,https://github.com/jingyaogong/minimind,
microsoft/AI-For-Beginners,47131,2026-05-03T03:10:31Z,2026-04-28,"12 Weeks, 24 Lessons, AI for All!",https://github.com/microsoft/AI-For-Beginners,
Kong/kong,43303,2026-05-02T22:26:29Z,2026-04-28,🦍 The API and AI Gateway,https://github.com/Kong/kong,
XingangPan/DragGAN,35886,2026-05-03T04:45:42Z,2026-04-28,Official Code for DragGAN (SIGGRAPH 2023),https://github.com/XingangPan/DragGAN,
ItzCrazyKns/Vane,34115,2026-05-03T04:42:38Z,2026-04-28,Vane is an AI-powered answering engine.,https://github.com/ItzCrazyKns/Vane,
explosion/spaCy,33539,2026-05-03T03:37:47Z,2026-04-28,💫 Industrial-strength Natural Language Processing (NLP) in Python,https://github.com/explosion/spaCy,
ashishpatel26/500-AI-Machine-learning-Deep-learning-Computer-vision-NLP-Projects-with-code,33398,2026-05-03T06:04:51Z,2026-04-28,500 AI Machine learning Deep learning Computer vision NLP Projects with code,https://github.com/ashishpatel26/500-AI-Machine-learning-Deep-learning-Computer-vision-NLP-Projects-with-code,
facebookresearch/fairseq,32213,2026-05-02T06:50:14Z,2026-04-28,Facebook AI Research Sequence-to-Sequence Toolkit written in Python.,https://github.com/facebookresearch/fairseq,
Lightning-AI/pytorch-lightning,31101,2026-05-03T03:59:29Z,2026-04-28,"Pretrain, finetune ANY AI model of ANY size on 1 or 10,000+ GPUs with zero code changes.",https://github.com/Lightning-AI/pytorch-lightning,
AMAI-GmbH/AI-Expert-Roadmap,30953,2026-05-02T19:54:56Z,2026-04-28,Roadmap to becoming an Artificial Intelligence Expert in 2022,https://github.com/AMAI-GmbH/AI-Expert-Roadmap,
feder-cr/Jobs_Applier_AI_Agent_AIHawk,29732,2026-05-03T03:42:42Z,2026-04-28,"AIHawk aims to easy job hunt process by automating the job application process. Utilizing artificial intelligence, it enables users to apply for multiple jobs in a tailored way.",https://github.com/feder-cr/Jobs_Applier_AI_Agent_AIHawk,
ZuzooVn/machine-learning-for-software-engineers,28760,2026-05-03T04:19:14Z,2026-04-28,A complete daily plan for studying to become a machine learning engineer.,https://github.com/ZuzooVn/machine-learning-for-software-engineers,
simstudioai/sim,28311,2026-05-03T06:10:31Z,2026-04-28,"Build, deploy, and orchestrate AI agents. Sim is the central intelligence layer for your AI workforce.",https://github.com/simstudioai/sim,
microsoft/semantic-kernel,27824,2026-05-02T23:23:52Z,2026-04-28,Integrate cutting-edge LLM technology quickly and easily into your apps,https://github.com/microsoft/semantic-kernel,
e2b-dev/awesome-ai-agents,27605,2026-05-03T05:25:11Z,2026-04-28,A list of AI autonomous agents,https://github.com/e2b-dev/awesome-ai-agents,
invoke-ai/InvokeAI,27087,2026-05-03T01:46:25Z,2026-04-28,"Invoke is a leading creative engine for Stable Diffusion models, empowering professionals, artists, and enthusiasts to generate and create visual media using the latest AI-driven technologies. The sol",https://github.com/invoke-ai/InvokeAI,
The-Art-of-Hacking/h4cker,26199,2026-05-03T01:24:54Z,2026-04-28,"This repository is maintained by Omar Santos (@santosomar) and includes thousands of resources related to ethical hacking, bug bounties, digital forensics and incident response (DFIR), AI security, vu",https://github.com/The-Art-of-Hacking/h4cker,
HandsOnLLM/Hands-On-Large-Language-Models,25698,2026-05-03T06:13:18Z,2026-04-28,"Official code repo for the O'Reilly Book - ""Hands-On Large Language Models""",https://github.com/HandsOnLLM/Hands-On-Large-Language-Models,
lucidrains/vit-pytorch,25138,2026-05-03T02:15:47Z,2026-04-28,"Implementation of Vision Transformer, a simple way to achieve SOTA in vision classification with only a single transformer encoder, in Pytorch",https://github.com/lucidrains/vit-pytorch,
usestrix/strix,24782,2026-05-03T05:40:43Z,2026-04-28,Open-source AI hackers to find and fix your app’s vulnerabilities.,https://github.com/usestrix/strix,
yamadashy/repomix,24263,2026-05-03T06:21:17Z,2026-04-28,"📦 Repomix is a powerful tool that packs your entire repository into a single, AI-friendly file. Perfect for when you need to feed your codebase to Large Language Models (LLMs) or other AI tools like C",https://github.com/yamadashy/repomix,
harvard-edge/cs249r_book,23983,2026-05-03T06:06:51Z,2026-04-28,Machine Learning Systems,https://github.com/harvard-edge/cs249r_book,
vercel/ai,23971,2026-05-03T04:43:09Z,2026-04-28,"The AI Toolkit for TypeScript. From the creators of Next.js, the AI SDK is a free open-source library for building AI-powered applications and agents ",https://github.com/vercel/ai,
tensorflow/tensorflow,194976,2026-05-03T06:16:58Z,2026-04-28,An Open Source Machine Learning Framework for Everyone,https://github.com/tensorflow/tensorflow,
pytorch/pytorch,99592,2026-05-03T05:50:28Z,2026-04-28,Tensors and Dynamic neural networks in Python with strong GPU acceleration,https://github.com/pytorch/pytorch,
microsoft/ML-For-Beginners,85605,2026-05-03T06:04:09Z,2026-04-28,"12 weeks, 26 lessons, 52 quizzes, classic Machine Learning for all",https://github.com/microsoft/ML-For-Beginners,
Developer-Y/cs-video-courses,80802,2026-05-03T06:18:41Z,2026-04-28,List of Computer Science courses with video lectures.,https://github.com/Developer-Y/cs-video-courses,
d2l-ai/d2l-zh,77589,2026-05-03T03:52:21Z,2026-04-28,《动手学深度学习》：面向中文读者、能运行、可讨论。中英文版被70多个国家的500多所大学用于教学。,https://github.com/d2l-ai/d2l-zh,
tesseract-ocr/tesseract,73861,2026-05-03T05:25:10Z,2026-04-28,Tesseract Open Source OCR Engine (main repository),https://github.com/tesseract-ocr/tesseract,
binhnguyennus/awesome-scalability,70780,2026-05-03T04:40:52Z,2026-04-28,"The Patterns of Scalable, Reliable, and Performant Large-Scale Systems",https://github.com/binhnguyennus/awesome-scalability,
labmlai/annotated_deep_learning_paper_implementations,66502,2026-05-03T05:53:22Z,2026-04-28,"🧑‍🏫 60+ Implementations/tutorials of deep learning papers with side-by-side notes 📝; including transformers (original, xl, switch, feedback, vit, ...), optimizers (adam, adabelief, sophia, ...), gans(",https://github.com/labmlai/annotated_deep_learning_paper_implementations,
scikit-learn/scikit-learn,65968,2026-05-03T04:40:25Z,2026-04-28,scikit-learn: machine learning in Python,https://github.com/scikit-learn/scikit-learn,
keras-team/keras,64059,2026-05-03T01:11:59Z,2026-04-28,Deep Learning for humans,https://github.com/keras-team/keras,
ultralytics/yolov5,57329,2026-05-03T02:35:01Z,2026-04-28,YOLOv5 🚀 in PyTorch > ONNX > CoreML > TFLite,https://github.com/ultralytics/yolov5,
ultralytics/ultralytics,56689,2026-05-03T05:48:20Z,2026-04-28,Ultralytics YOLO 🚀,https://github.com/ultralytics/ultralytics,
ageitgey/face_recognition,56364,2026-05-02T21:19:47Z,2026-04-28,The world's simplest facial recognition api for Python and the command line,https://github.com/ageitgey/face_recognition,
deepfakes/faceswap,55202,2026-05-03T04:52:29Z,2026-04-28,Deepfakes Software For All,https://github.com/deepfakes/faceswap,
Avik-Jain/100-Days-Of-ML-Code,50825,2026-05-03T04:44:35Z,2026-04-28,100 Days of ML Coding,https://github.com/Avik-Jain/100-Days-Of-ML-Code,
JuliaLang/julia,48652,2026-05-02T19:16:51Z,2026-04-28,The Julia Programming Language,https://github.com/JuliaLang/julia,
GokuMohandas/Made-With-ML,47477,2026-05-03T03:29:02Z,2026-04-28,"Learn how to develop, deploy and iterate on production-grade ML applications.",https://github.com/GokuMohandas/Made-With-ML,
apache/airflow,45264,2026-05-03T06:11:33Z,2026-04-28,"Apache Airflow - A platform to programmatically author, schedule, and monitor workflows",https://github.com/apache/airflow,
streamlit/streamlit,44429,2026-05-03T06:21:49Z,2026-04-28,Streamlit — A faster way to build and share data apps.,https://github.com/streamlit/streamlit,
aymericdamien/TensorFlow-Examples,43781,2026-05-02T17:00:04Z,2026-04-28,TensorFlow Tutorial and Examples for Beginners (support TF v1 & v2),https://github.com/aymericdamien/TensorFlow-Examples,
gradio-app/gradio,42485,2026-05-03T04:52:28Z,2026-04-28,"Build and share delightful machine learning apps, all in Python. 🌟 Star to support our work!",https://github.com/gradio-app/gradio,
ray-project/ray,42407,2026-05-03T06:14:02Z,2026-04-28,Ray is an AI compute engine. Ray consists of a core distributed runtime and a set of AI Libraries for accelerating ML workloads.,https://github.com/ray-project/ray,
opencv/opencv,87322,2026-05-03T02:47:46Z,2026-04-28,Open Source Computer Vision Library,https://github.com/opencv/opencv,
dair-ai/Prompt-Engineering-Guide,74130,2026-05-03T06:16:27Z,2026-04-28,"🐙 Guides, papers, lessons, notebooks and resources for prompt engineering, context engineering, RAG, and AI Agents.",https://github.com/dair-ai/Prompt-Engineering-Guide,
CorentinJ/Real-Time-Voice-Cloning,59711,2026-05-02T22:49:37Z,2026-04-28,Clone a voice in 5 seconds to generate arbitrary speech in real-time,https://github.com/CorentinJ/Real-Time-Voice-Cloning,
coqui-ai/TTS,45208,2026-05-03T05:48:42Z,2026-04-28,"🐸💬 - a deep learning toolkit for Text-to-Speech, battle-tested in research and production",https://github.com/coqui-ai/TTS,
deepspeedai/DeepSpeed,42239,2026-05-03T04:52:24Z,2026-04-28,"DeepSpeed is a deep learning optimization library that makes distributed training and inference easy, efficient, and effective.",https://github.com/deepspeedai/DeepSpeed,
hpcaitech/ColossalAI,41374,2026-05-02T15:18:56Z,2026-04-28,"Making large AI models cheaper, faster and more accessible",https://github.com/hpcaitech/ColossalAI,
microsoft/qlib,41861,2026-05-03T06:20:16Z,2026-04-28,"Qlib is an AI-oriented Quant investment platform that aims to use AI tech to empower Quant Research, from exploring ideas to implementing productions. Qlib supports diverse ML modeling paradigms, incl",https://github.com/microsoft/qlib,
floodsung/Deep-Learning-Papers-Reading-Roadmap,39499,2026-05-03T04:01:22Z,2026-04-28,Deep Learning papers reading roadmap for anyone who are eager to learn this amazing tech!,https://github.com/floodsung/Deep-Learning-Papers-Reading-Roadmap,
roboflow/supervision,38298,2026-05-03T06:05:04Z,2026-04-28,We write your reusable computer vision tools. 💜,https://github.com/roboflow/supervision,
naptha/tesseract.js,38046,2026-05-03T01:33:18Z,2026-04-28,Pure Javascript OCR for more than 100 Languages 📖🎉🖥,https://github.com/naptha/tesseract.js,
TencentARC/GFPGAN,37443,2026-05-02T17:00:11Z,2026-04-28,GFPGAN aims at developing Practical Algorithms for Real-world Face Restoration.,https://github.com/TencentARC/GFPGAN,
langflow-ai/langflow,147641,2026-05-03T06:05:36Z,2026-04-28,Langflow is a powerful tool for building and deploying AI-powered agents and workflows.,https://github.com/langflow-ai/langflow,
microsoft/ai-agents-for-beginners,60358,2026-05-03T05:38:29Z,2026-04-28,12 Lessons to Get Started Building AI Agents,https://github.com/microsoft/ai-agents-for-beginners,
asgeirtj/system_prompts_leaks,39396,2026-05-03T05:25:08Z,2026-04-28,"Extracted system prompts from ChatGPT (GPT-5.5 Thinking), Claude (Opus 4.7, Opus 4.6, Sonnet 4.6, Claude Code), Gemini (3.1 Pro, 3 Flash, Gemini CLI), Grok (4.3 beta), Perplexity, and more. Updated re",https://github.com/asgeirtj/system_prompts_leaks,
langchain-ai/langgraph,31071,2026-05-03T06:09:41Z,2026-04-28,Build resilient language agents as graphs.,https://github.com/langchain-ai/langgraph,
aishwaryanr/awesome-generative-ai-guide,26498,2026-05-03T04:15:30Z,2026-04-28,"A one stop repository for generative AI research updates, interview resources, notebooks and much more!",https://github.com/aishwaryanr/awesome-generative-ai-guide,
deepset-ai/haystack,25060,2026-05-03T05:44:14Z,2026-04-28,"Open-source AI orchestration framework for building context-engineered, production-ready LLM applications. Design modular pipelines and agent workflows with explicit control over retrieval, routing, m",https://github.com/deepset-ai/haystack,
a2aproject/A2A,23560,2026-05-03T05:45:54Z,2026-04-28,Agent2Agent (A2A) is an open protocol enabling communication and interoperability between opaque agentic applications.,https://github.com/a2aproject/A2A,
wandb/openui,22265,2026-05-03T02:13:08Z,2026-04-28,"OpenUI let's you describe UI using your imagination, then see it rendered live.",https://github.com/wandb/openui,
jina-ai/serve,21873,2026-05-02T16:19:05Z,2026-04-28,☁️ Build multimodal AI applications with cloud-native stack,https://github.com/jina-ai/serve,
coze-dev/coze-studio,20674,2026-05-03T05:51:37Z,2026-04-28,"An AI agent development platform with all-in-one visual tools, simplifying agent creation, debugging, and deployment like never before. Coze your way to AI Agent creation.",https://github.com/coze-dev/coze-studio,
dyad-sh/dyad,20227,2026-05-03T05:37:33Z,2026-04-28,"Local, open-source AI app builder for power users ✨ v0 / Lovable / Replit / Bolt alternative 🌟 Star if you like it!",https://github.com/dyad-sh/dyad,
NirDiamant/agents-towards-production,19015,2026-05-03T05:36:34Z,2026-04-28,"End-to-end, code-first tutorials for building production-grade GenAI agents. From prototype to enterprise deployment.",https://github.com/NirDiamant/agents-towards-production,
NVIDIA-NeMo/NeMo,17161,2026-05-03T05:24:25Z,2026-04-28,"A scalable generative AI framework built for researchers and developers working on Large Language Models, Multimodal, and Speech AI (Automatic Speech Recognition and Text-to-Speech)",https://github.com/NVIDIA-NeMo/NeMo,
lyogavin/airllm,17085,2026-05-03T05:21:39Z,2026-04-28,AirLLM 70B inference with single 4GB GPU,https://github.com/lyogavin/airllm,
GoogleCloudPlatform/generative-ai,16778,2026-05-02T23:23:52Z,2026-04-28,"Sample code and notebooks for Generative AI on Google Cloud, with Gemini Enterprise Agent Platform",https://github.com/GoogleCloudPlatform/generative-ai,
ai-shifu/ChatALL,16368,2026-05-02T10:26:26Z,2026-04-28," Concurrently chat with ChatGPT, Bing Chat, Bard, Alpaca, Vicuna, Claude, ChatGLM, MOSS, 讯飞星火, 文心一言 and more, discover the best answers",https://github.com/ai-shifu/ChatALL,
Tencent/WeKnora,14183,2026-05-03T05:22:33Z,2026-04-28,"Open-source LLM knowledge platform: turn raw documents into a queryable RAG, an autonomous reasoning agent, and a self-maintaining Wiki.",https://github.com/Tencent/WeKnora,
dottxt-ai/outlines,13775,2026-05-03T03:09:56Z,2026-04-28,Structured Outputs,https://github.com/dottxt-ai/outlines,
rowboatlabs/rowboat,13230,2026-05-03T05:05:01Z,2026-04-28,"Open-source AI coworker, with memory",https://github.com/rowboatlabs/rowboat,
